name,url,visibility,language,default_branch,created_time,updated_time,size,open_issues_count,notes,decision,justification
salesmartins,https://github.com/jeanrrf/salesmartins,public,Python,master,2025-04-01,2026-03-22,39430,1,Frontend + backend (api.js) with JWT admin,keep,Core product repo: keep, hardening and tests required; canonical source for vitrine and API
v2-of-sales-martins,https://github.com/jeanrrf/v2-of-sales-martins,private,TypeScript,main,2025-07-16,2025-07-17,260,0,Docs de integração Shopee; supabaseClient com key hardcoded,keep,Planning and infra for V2: keep as canonical design repo; remove hardcoded keys
BACKEN_NODEJS_SIAW,https://github.com/jeanrrf/BACKEN_NODEJS_SIAW,private,TypeScript,main,2025-05-30,2025-12-20,2952,0,Next API for generate-link; SQL schema shopee_products,keep,Core backend service: keep and harden; extract shared services (shopee-auth, supabase client)
PRD_SIAW_VERCEL_SHO_MAE,https://github.com/jeanrrf/PRD_SIAW_VERCEL_SHO_MAE,public,JavaScript,main,2025-04-09,2025-04-11,30229,0,Deploy público (prod/demo),keep,Production/demo site: keep as staging/production; ensure CI and secret management
champion_shope,https://github.com/jeanrrf/champion_shope,private,HTML,master,2025-03-24,2025-03-25,1548,0,Auth Shopee (python) and assets,keep,Contains Shopee auth implementation: extract auth module into shared service and keep repo for reference
